Control_ID,Control_Description
CTRL-0000001047,"A DR test plan shall be defined for System Assets rated as having SEVERE or MAJOR business impact in terms of Availability, with success criteria established in advance of testing."
CTRL-0000001046,A DR Plan shall be developed to recover from cyber security incidents for System Assets rated as having SEVERE or MAJOR business impact in terms of Availability.
CTRL-0000001045,"Data backups shall be logged, and securely stored/maintained in accordance with the agreed backup and restoration plan."
CTRL-0000001044,Backup information shall be retained based on the backup & restore plan.
CTRL-0000001042,"Changes to IT & OT System Assets shall be reviewed to ensure that they were successful, and then finally signed off by the relevant authority."
CTRL-0000001041,"Requirements for backup of System Assets and data rated as being SEVERE or MAJOR business impact in terms of Availability, shall be part of the System Asset DR Plan. This shall include retention requirements, where applicable."
CTRL-0000001040,Data backups shall be performed as per the backup plan agreed with the business/application/service owners.
CTRL-0000001039,Third Party software providers shall provide assurance of code integrity and absence of vulnerabilities.
CTRL-0000001038,"Changes to IT System Assets shall be formally requested, planned, approved and initiated. Changes to OT assets shall be as per the site's MOC procedures and guidelines and the PTW system of the facility."
CTRL-0000001037,Changes shall be deployed in accordance with the agreed roll-out plan for the change.
CTRL-0000001036,"Changes to IT System Assets shall be properly tested in Test environments (where available), prior to deployment in Production. Changes to OT Assets, as per the MOC, shall be tested in the Factory Acceptance Test (FAT) followed by Site Acceptance Test (SAT). Testing shall cover cyber security aspects, where appropriate (e.g. negative testing of access controls)."
CTRL-0000001035,The project delivery framework shall be applied to all IT and OT projects.
CTRL-0000001034,Source code shall be protected against unauthorised access or change.
CTRL-0000001033,Cyber security testing shall be undertaken before new or changed IT systems/applications are migrated to Production environments.
CTRL-0000001031,End-points shall be hardened in accordance with the defined specifications.
CTRL-0000001030,"Capacity resources shall be monitored and reported for System Assets rated as having SEVERE or MAJOR business impact in terms of Availability, to ascertain their adequacy in maintaining availability, and to prevent misuse. The usage capacity monitoring shall include system memory storage and network utilisation."
CTRL-0000001029,"End-point IT operating software releases shall be kept up-to-date. Software shall be:
a. licenced and supported by the vendor; 
b. within two major releases of the latest major vendor release (i.e. n-2, at the oldest);
c. removed from devices when no longer supported."
CTRL-0000001028,System & network capacity requirements shall be identified as part IT service development.  Additional capacity shall be factored in for System Assets rated as having SEVERE or MAJOR business impact in terms of Availability.
CTRL-0000001026,"Passwords shall not be displayed anywhere on Physical Assets, or documented in operating manuals, or hard-coded in source code."
CTRL-0000001025,The minimum password age for Privileged IT Acounts shall be one (1) day and maximum age of passwords shall be thirty (30) days.
CTRL-0000001024,"MFA shall be used for access to IT System Assets assessed as having a CS BIA rating of SEVERE or MAJOR due to loss of Confidentiality, Integrity, or Availability."
CTRL-0000001023,"Access rights and privileges shall be provided in accordance with the principle of ""Least Privilege"", and shall be in line with defined access policies for System Assets."
CTRL-0000001022,"Changes in user access, through modifications of roles or permissions, shall be properly controlled."
CTRL-0000001021,"Role-based access shall be granted to only perform authorised duties, which are relevant to corresponding job roles and responsibilities."
CTRL-0000001020,"Access by Third Parties (e.g. vendors, service providers, partner companies etc.) shall be securely managed, in order to ensure that only specifically-required access is provided for the agreed period."
CTRL-0000001019,Inactive accounts shall be disabled to avoid the risks of unused/unnecessary accounts being present for unauthorised use.
CTRL-0000001018,There shall be a user access review process in place to ensure accounts are still required and access rights remain appropriate.
CTRL-0000001017,Remote connection shall be disabled by default on End-Points.
CTRL-0000001016,"Access policies shall be defined for Company networks, System Assets and services, taking into account requirements for segregation of duties and responsibilities."
CTRL-0000001015,"A formal user account provisioning process shall be in place, for provision of all types of accounts."
CTRL-0000001014,"In the case of a change in role or access requirement, an access modification request shall be raised and actioned."
CTRL-0000001013,"Use of privileged IT/OT accounts shall be strictly controlled, to avoid the risks of system misuse or compromize."
CTRL-0000001012,"User accounts shall be de-provisioned in a timely way, to avoid the risks of unused/unnecessary accounts being retained."
CTRL-0000001011,"Emergency accounts shall only be used when access to privileged accounts is unavailable, and shall be strictly controlled."
CTRL-0000001010,"Use of IT service accounts shall be strictly controlled, in order to avoid risks of compromise."
CTRL-0000001009,"Generic and Default accounts (e.g. as provided with “out-of-the-box” installations) shall be subject to password change, and strong password rules, in order to avoid risks of compromise."
CTRL-0000001008,"Test accounts shall be strictly controlled, in order to avoid risks of compromise, or impact on Production systems."
CTRL-0000001007,Export of Personal Data or Sensitive Personal Data shall only be permitted in accordance with applicable laws & regulations.
CTRL-0000001006,"Unique user ID's shall be attested, securely created and assigned to individual Employees, Contractors, and Third Party Users."
CTRL-0000001005,"Protective controls shall be applied to handle data in Development & Test environments, according to its classification."
CTRL-0000001003,Personal Data and Sensitive Personal Data shall be collected in compliance with applicable data privacy laws.
CTRL-0000001002,All System Assets shall have an asset owner identified.
CTRL-0000001001,Personal Data and Sensitive Personal Data shall be processed in compliance with applicable data privacy laws.
CTRL-0000001000,Personal Data and Sensitive Personal Data shall be managed & controlled in compliance with applicable data privacy laws.
