Guidance_ID,Guidance_Description,Control_ID,Control_Description
FUNC-0000001619,Establish policies and procedures for vendor access and management of IoT devices. This includes data that can be transmitted out of the organization (e.g. telemetry or machine data) and authorized roles and minimum access security requirements for management of the devices within the organizations' networks.  Enforce these controls and monitor for abuse.,CTRL-0000001180,Third Party access to the Company IT & OT System Assets shall be accompanied by a Third Party Access Agreement containing the cyber security responsibilities of the user(s).
FUNC-0000001549,"Establish policy to never share private keys across multiple devices or groups and to incorporate forward-secrecy whenever possible for key derivations (e.g., do not use static mechanisms). Keys should always be stored in a secure element (either software or hardware) capable of restricting access to keys by unauthorized actors.",CTRL-0000001601,"Where cryptography is used to protect stored account data, key management processes and procedures covering all aspects of the key lifecycle shall be defined and implemented."
FUNC-0000001595,"Establish process checks within the procurement lifecycle to validate that vendors participate in bug bounties. If possible, request manufacturer program report data for accepted bounty submissions at least annually.",CTRL-0000001171,"Supplier agreements shall be established and documented with suppliers of all IT/OT solutions and/or services for the Company business use, via the Company standard procurement practices. These agreements shall include the relevant Company’s cyber security and legal & regulatory requirements."
FUNC-0000001500,"Establish process for analyzing device and associated service data. Review device logs, gateway logs, network security device logs and SaaS API logs to identify potential misuse and indicators of compromise.",CTRL-0000001513,"APIs shall be configured for secure access, secure API shielding, secure data transfer, and security event logging & monitoring."
FUNC-0000001563,"Establish processes and relationships with IoT device vendors to obtain their support when needed as part of an incident response and forensic analysis process, and with other stakeholders to collaboration and share information on the latest threats and vulnerabilities.",CTRL-0000001341,"The Company Employees, Contractors, joint venture staff, service providers, Suppliers and other Third Parties shall be made aware of the incident reporting channels and procedures, and of their roles & responsibilities for reporting & managing cyber security events & incidents."
FUNC-0000001570,Establish processes for returning compromised devices to normal operations. These processes should include at minimum testing of the device and validation of configuration settings.,CTRL-0000001339,Cyber security incidents shall be responded to in accordance with Company Incident Response Plan (IRP).
FUNC-0000001636,"Establish red team exercises within your organization to actively exploit IoT system vulnerabilities. Provide sufficient threat documentation to allow red team operators to identify and target weak areas. Provide red teams with sufficient time to fully explore weaknesses and properly plan exploit scenarios that should be proposed prior to fieldwork. Assure that red team scope includes network, application and physical layers of the IoT system architecture. Red team testing activities should use tactics and techniques based on MITRE ATT&CK.",CTRL-0000001054,"Technical vulnerability scans, assessments (including patching assessments), and penetration testing shall be performed for IT systems and networks, taking into account IT and service requirements and constraints. Any types of technical vulnerability scans, or assessments for OT systems shall be passive, and based on risk assessment. No penetration test to be done for OT systems."
FUNC-0000001639,Establish responsible disclosure policies for reporting of vulnerabilities by the security research community.  Establish guidelines and procedures for working with independent testers that report vulnerabilities.  Establish procedures to add independently-reported vulnerabilities to the system backlog for prioritization and remediation.,CTRL-0000001054,"Technical vulnerability scans, assessments (including patching assessments), and penetration testing shall be performed for IT systems and networks, taking into account IT and service requirements and constraints. Any types of technical vulnerability scans, or assessments for OT systems shall be passive, and based on risk assessment. No penetration test to be done for OT systems."
FUNC-0000001518,"Establish secure configuration documents (SCD) for each IoT device, gateway, and cloud service.",CTRL-0000001053,Configuration management processes and procedures (for ensuring consistency and performance of IT & OT System Assets) shall incorporate checking of configurations of System Assets against requirements laid out in the relevant hardening specifications.
FUNC-0000001548,"Establish secure key management processes for IoT systems that include at a minimum key generation, key derivation, key establishment/transport, key storage, key lifetimes, and key zeroization/destruction.  Keys should be generated on the devices they will be used upon whenever possible, assuming those devices have a sufficiently random source of entropy.",CTRL-0000001601,"Where cryptography is used to protect stored account data, key management processes and procedures covering all aspects of the key lifecycle shall be defined and implemented."
FUNC-0000001587,Evaluate and test operator/occupant interaction with autonomous systems to validate the ability of the operator/occupant to take control and/or resolve cyber anomaly issues should they occur.,CTRL-0000001375,"Protection against physical and environmental threats, such as natural or man-made disasters, as well as accidental or deliberate physical threats to Company premises shall be addressed."
FUNC-0000001535,Evaluate liability potential of an IoT system when that system physically interacts with the public or workers. Define safety restrictions and post warning notices to limit liability,CTRL-0000001482,"System assets shall be categorised based on the impact ratings in the CS BIA, for impact of loss of Confidentiality, integrity and/or availability.  
There are five impact levels: Severe, Major, Moderate, Minor, Insignificant."
FUNC-0000001532,"Evaluate the safety impacts of an IoT system, log all safety risks, prioritize the risks, and implement mitigations for each risk.  Incorporate device and environmental controls to enforce safety requirements, as necessary.",CTRL-0000001482,"System assets shall be categorised based on the impact ratings in the CS BIA, for impact of loss of Confidentiality, integrity and/or availability.  
There are five impact levels: Severe, Major, Moderate, Minor, Insignificant."
FUNC-0000001387,"Event data should be collected and analysed (e.g. SIEM event data), in order to create an up-to-date ""baseline"" of expected events.",CTRL-0000001509,"An understanding of normally-expected data flows and operations should be developed and refined over time, in order to facilitate the identification & alerting of anomalous events."
FUNC-0000001364,"Event logging should capture at minimum:
a. Account and object logon success and failures
b. Discovery of infected files
c. System shutdowns and restarts
d. Change of configuration file/user permission
e. Change/reset of passwords
f. Account or group (incl. super-user group) addition/deletion/modification
g. Log file modifications and deletions
i. Admin and system operator activities
j. Addition of network devices
k. Detection of network and system anomalies",CTRL-0000001051,Cyber security requirements for event logging shall be identified for IT and OT System Assets.
FUNC-0000001030,Every user identity (ID) should be unique for each individual and always connected with the account of the single user to whom it has been assigned.,CTRL-0000001006,"Unique user ID's shall be attested, securely created and assigned to individual Employees, Contractors, and Third Party Users."
FUNC-0000001107,External networks which host internet facing devices should be segregated from internal networks.,CTRL-0000001422,The Company IT network boundaries & perimeters shall be securely managed in order to effectively protect trusted networks from untrusted networks.
FUNC-0000001137,Federation should be enabled only where there is established trust between Company and the correlating Third Party.,CTRL-0000001415,"All users & devices shall be subject to the Company mandatory registration and authentication requirements, for access to all Company System Assets, using architectural components approved by the appointed CS architectural authorities."
FUNC-0000001284,"Findings should be checked against the OWASP Top 10 list, Common Weakness Enumerations (CWE) awareness, secure coding, 3rd-party or open-source component aging, etc.",CTRL-0000001033,Cyber security testing shall be undertaken before new or changed IT systems/applications are migrated to Production environments.
FUNC-0000001462,"Firewall configurations, router configurations and associated documentation should be considered as confidential and should be available only to authorised personnel (administrators, auditors, information security management personnel etc.)",CTRL-0000001186,"IT network device security shall be ensured through implementation of hardening specifications approved by the appointed CS architectural authorities, in combination with secure technical configuration & documented management processes, including firewall configuration and rule-set management."
FUNC-0000001465,"Firewall rule-sets should be reviewed on a six-monthly basis, at least.",CTRL-0000001186,"IT network device security shall be ensured through implementation of hardening specifications approved by the appointed CS architectural authorities, in combination with secure technical configuration & documented management processes, including firewall configuration and rule-set management."
FUNC-0000001116,Firewalls and routers should be configured to convert the source IP address and TCP port number on packets to externally routable values.,CTRL-0000001418,"Secure network routing controls shall be established at the boundaries between the Company IT network and external networks, based on source and destination address checking mechanisms."
FUNC-0000001127,Firewalls should be configured to restrict access from the IaaS/PaaS CSP's network to Company’ on-premise network to specifically-approved connections (via Third Party Access Management).,CTRL-0000001171,"Supplier agreements shall be established and documented with suppliers of all IT/OT solutions and/or services for the Company business use, via the Company standard procurement practices. These agreements shall include the relevant Company’s cyber security and legal & regulatory requirements."
FUNC-0000001809,"For components that utilize password-based authentication, those components should provide or integrate into a system that provides the capability to enforce configurable password
strength according to internationally recognized and proven password guidelines.",CTRL-0000001081,"SR 1.7 - For control systems utilizing password-based authentication, the control system shall provide the capability to enforce configurable password strength based on minimum length and variety of character types."
FUNC-0000001812,"For components that utilize public-key-based authentication, those components should provide
directly or integrate into a system that provides the capability within the same IACS environment to:
a) validate certificates by checking the validity of the signature of a given certificate;
b) validate the certificate chain or, in the case of self-signed certificates, by deploying leaf certificates to all hosts that communicate with the subject to which the certificate is issued;
c) validate certificates by checking a given certificate’s revocation status;
d) establish user (human, software process or device) control of the corresponding private key;
e) map the authenticated identity to a user (human, software process or device); and
f) ensure that the algorithms and keys used for the public key authentication conform to CR 4.3.",CTRL-0000001107,"SR 1.9 - For control systems utilizing public key authentication, the control system shall provide the capability to:
a) validate certificates by checking the validity of the signature of a given certificate;
b) validate certificates by constructing a certification path to an accepted CA or in the case of self-signed certificates by deploying leaf certificates to all hosts which communicate with the subject to which the certificate is issued;
c) validate certificates by checking a given certificate’s revocation status;
d) establish user (human, software process or device) control of the corresponding private key; and
e) map the authenticated identity to a user (human, software process or device)."
FUNC-0000001817,"For components that utilize symmetric keys, the component should provide the capability to:
a) establish the mutual trust using the symmetric key;
b) store securely the shared secret (the authentication is valid as long as the shared secret remains secret);
c) restrict access to the shared secret; and
d) ensure that the algorithms and keys used for the symmetric key authentication conform to CR 4.3.",CTRL-0000001084,SR 1.13 - The control system shall provide the capability to monitor and control all methods of access to the control system via untrusted networks.
FUNC-0000001622,"For each IoT system, define end-of-life procedures for the hardware used within that system. For any hardware that stores sensitive information, dispose of that hardware securely and maintain an audit log of the disposal process including any individual that participates in that process.  Secure disposal process can include as applicable: data sanitization, degaussing, and so on.",CTRL-0000001405,"All identified Physical Assets to be disposed of (e.g. end-of-life End-points, Mobile Devices, storage media etc.) that may contain the Company's data, shall be sanitised and securely disposed by authorised personnel."
FUNC-0000001431,"For IaaS services, where Company is responsible for vulnerability management, security vulnerability assessment tools should ensure to accommodate the virtualisation technologies used (e.g. virtualisation aware).",CTRL-0000001300,"For outsource/Cloud infrastructure services, where the Company is responsible for vulnerability management, then the Company standard tools and techniques shall be used, where possible."
FUNC-0000001557,"For IoT devices that operate with a real-time operating system (RTOS), ensure that the RTOS provides a minimum set of security features including application sandboxing, secure boot, access controls, trusted execution environment, kernel separation, and a (minimized) microkernel.",CTRL-0000001185,"Hardening specifications for all types of the Company-managed End-points shall be defined and approved by the appointed CS architectural authorities, to ensure that they can be Secure-by-Design."
FUNC-0000001583,"For mobile IoT devices, implement geofencing restrictions to monitor or control location of device to collect location data for use in authorization decisions.",CTRL-0000001375,"Protection against physical and environmental threats, such as natural or man-made disasters, as well as accidental or deliberate physical threats to Company premises shall be addressed."
FUNC-0000001434,"For outsource/IaaS cloud solutions, automatic patching of vulnerabilities should be considered (rather than manual patch deployment).",CTRL-0000001300,"For outsource/Cloud infrastructure services, where the Company is responsible for vulnerability management, then the Company standard tools and techniques shall be used, where possible."
FUNC-0000001221,"For outsource/IaaS cloud solutions, secure hardened images should a basis for building systems.",CTRL-0000001031,End-points shall be hardened in accordance with the defined specifications.
FUNC-0000001078,"For PCS equipment cabinets that are not located in secured rooms, the cabinets should be physically locked with the keys managed by the PCS Engineer.",CTRL-0000001297,"Secure Areas (e.g. computer rooms, secured cabinets etc.) shall be created within the Company’s premises for placing/storing System Assets that require extra physical protection/isolation. Sufficient physical barriers shall be in place to restrict entry to authorized persons only."
FUNC-0000001059,"For privileged IT access to be granted to a user the necessary approvals should be required, according to the business standard. The issuing of access to a privileged account by an individual without the completion of the user access authorization process should be considered a security breach.",CTRL-0000001013,"Use of privileged IT/OT accounts shall be strictly controlled, to avoid the risks of system misuse or compromize."
FUNC-0000001808,"For software process and device users, the control system shall provide the capability to protect the relevant authenticators via hardware mechanisms.",CTRL-0000001078,"SR 1.5 RE 1 - For software process and device users, the control system shall provide the capability to protect the relevant authenticators via hardware mechanisms."
FUNC-0000001484,"For solutions involving data masking, this should be used in accordance with the organization’s topic-specific policy on access control and other related topic-specific policies, and business requirements, taking applicable legislation into consideration.",CTRL-0000001383,"Access rights and privileges shall be provided in accordance with the principle of Least Privilege, and shall be in line with defined access policies for System Assets."
FUNC-0000001362,"For suppliers of Physical Assets, contracts should cover the provision of support, recommendations and guidelines for adequate maintenance.",CTRL-0000001362,"IT and OT Physical Assets shall be effectively maintained, commensurate with risk-assessment and defined controls."
FUNC-0000001430,"Forensic steps should be performed in line with Chain of Custody requirements, in order to ensure correct preservation & support admissibility of evidence in case of legal action.",CTRL-0000001307,"Response to a cyber security incident should involve Forensic Analysis, and evidence gathering, where necessary."
FUNC-0000001379,"Formal data-transfer policies, procedures and controls should be in place to protect the transfer of information using all types of communication facilities.",CTRL-0000001502,"The Company information/data classified as Confidential, or handled by System Assets rated as having MAJOR business impact in terms of Confidentiality and/or SEVERE business impact in terms of Integrity, should be protected by Strong Encryption whilst in transit."
FUNC-0000001356,Formal disciplinary processes should be defined and communicated for breaches of cyber security.,CTRL-0000001369,Management shall require all Employees and Contractors to apply cyber security in accordance with the established standards and procedures of the Company.
FUNC-0000001159,Full disk encryption agents should receive updates automatically.,CTRL-0000001601,"Where cryptography is used to protect stored account data, key management processes and procedures covering all aspects of the key lifecycle shall be defined and implemented."
FUNC-0000001256,Functional and detailed design specifications should cater for Company cyber security requirements and approval by the appropriate architectural & cyber security authorities.,CTRL-0000001387,"Cyber security shall be addressed as part of project delivery frameworks/models, to ensure that engagement with the Cyber Security Function occurs at appropriate times in projects, and that necessary controls are identified and implemented. The framework/model shall include the development & acquisition of hardware, software, on-premise & cloud-based services."
FUNC-0000001186,"Future capacity requirements should be anticipated by taking into consideration new businesses, system requirements and translated into business cases for consideration.",CTRL-0000001028,System & network capacity requirements shall be identified as part IT service development.  Additional capacity shall be factored in for System Assets rated as having SEVERE or MAJOR business impact in terms of Availability.
FUNC-0000001034,"Generic, group or shared ID’s, which cannot be linked back to individuals should not be permitted.",CTRL-0000001009,"Generic and Default accounts (e.g. as provided with “out-of-the-box” installations) shall be subject to password change, and strong password rules, in order to avoid risks of compromise."
FUNC-0000001921,Goals should be established and agreed with employees and contractors to help achieve a culture of cyber security and cyber resilience across the organization,CTRL-0000001369,Management shall require all Employees and Contractors to apply cyber security in accordance with the established standards and procedures of the Company.
FUNC-0000001281,"Group Digital should implement, monitor & manage IT software licencing compliance, such that:
1. No software should be deployed for which the business has not obtained a valid licence (e.g. via procurement or via an entitlement from a Group contract);
2. For software under the responsibility of Group Digital, the licence and entitlement details that are relevant for reconciliation with deployment should be recorded;
3. For recorded entitlements, deployment should be measured, reconciled with entitlement and any gaps addressed. Any deployment changes should be reflected in the deployment records.",CTRL-0000001383,"Access to and/or use of proprietary applications, programs, or any other forms of intellectual property (IP), shall be appropriately restricted according to licencing terms & conditions."
FUNC-0000001344,"Hard-copy materials with cardholder data are destroyed when no longer needed for business or legal reasons, as follows:
• Materials are cross-cut shredded, incinerated, or pulped so that cardholder data cannot be reconstructed. 
• Materials are stored in secure storage containers prior to destruction.",CTRL-0000001517,"Data shall be securely disposed of, in accordance with any defined retention policy & disposal procedures, where applicable."
FUNC-0000001243,Hardening configuration parameters for database technologies and common middleware platforms should be tested in a test environment before deployment in a production environment.,CTRL-0000001188,"Hardening specifications for database technologies & common middleware platforms shall be defined, approved by the appointed CS architectural authorities, and implemented, to ensure that they can be properly secured."
FUNC-0000001207,Hardening configuration parameters for End-points should be tested in a Test environment before deployment in a Production environment.,CTRL-0000001185,"Hardening specifications for all types of the Company-managed End-points shall be defined and approved by the appointed CS architectural authorities, to ensure that they can be Secure-by-Design."
FUNC-0000001471,"Hardening specifications for all types of Network Devices should be selected or developed, based on industry best practices (e.g. CIS Benchmarks, Company security specifications), to ensure that devices can be properly secured. The specifications should be reviewed and updated on at least a six-monthly basis to ensure they are still effective,",CTRL-0000001186,"IT network device security shall be ensured through implementation of hardening specifications approved by the appointed CS architectural authorities, in combination with secure technical configuration & documented management processes, including firewall configuration and rule-set management."
FUNC-0000001923,"Hardening specifications for all types of the Company-managed End-points should be defined and approved by the appointed CS architectural authorities, to ensure that they can be Secure-by-Design.",CTRL-0000001599,"IT security hardening specifications shall be established, documented, approved by appointed CS architectural authorities. implemented, monitored and reviewed."
FUNC-0000001924,"Hardening specifications for database technologies & common middleware platforms should be defined, approved by the appointed CS architectural authorities, and implemented, to ensure that they can be properly secured.",CTRL-0000001599,"IT security hardening specifications shall be established, documented, approved by appointed CS architectural authorities. implemented, monitored and reviewed."
FUNC-0000001222,"HIPS should be able to perform security monitoring such as code and network traffic analysis, network traffic filtering, and system’s files monitoring.",CTRL-0000001505,Host-based Firewalls and Host-based Intrusion Prevention Systems (HIPS) should be implemented to avoid data breaches.
FUNC-0000001224,HIPS should be configured to implement the most restrictive policy allowed and then permit only what is needed.,CTRL-0000001505,Host-based Firewalls and Host-based Intrusion Prevention Systems (HIPS) should be implemented to avoid data breaches.
FUNC-0000001226,"HIPS should be integrated with the SIEM solution and configured to send notifications, if any events occur.",CTRL-0000001505,Host-based Firewalls and Host-based Intrusion Prevention Systems (HIPS) should be implemented to avoid data breaches.
