Guidance_ID,Guidance_Description,Control_ID,Control_Description
FUNC-0000001232,Restrictions and controls on Bluetooth pairing capabilities should be enforced (e.g. requirement for PIN protection before allowing pairing).,CTRL-0000001390,"The Company information accessed from, and stored in Mobile Devices shall be protected through a combination of device registration & authentication, access control, device-hardening in line with the Company End-point platform cyber security technical baselines, user awareness, and physical security controls."
FUNC-0000001672,Review and identify devices that contain default passwords and change those passwords immediately (preferably before connecting to a network). Identify passwords shared across multiple devices and change those passwords immediately to unique values per device.,CTRL-0000001009,"Generic and Default accounts (e.g. as provided with “out-of-the-box” installations) shall be subject to password change, and strong password rules, in order to avoid risks of compromise."
FUNC-0000001510,Review IoT inventories annually to identify products used within the enterprise that have reached or will reach end-of-life within the next year. This should include checks to ensure that the vendor has not announced plans to discontinue support for the products or their associated services.  Flag any device at risk of end-of-life and take actions to procure updated devices.,CTRL-0000001029,"End-point IT operating software releases shall be kept up-to-date. Software shall be:
a. licenced and supported by the vendor; 
b. within two major releases of the latest major vendor release (i.e. n-2, at the oldest);
c. removed from devices when no longer supported."
FUNC-0000001170,"Revoke and remove cryptographic keys prior to the end of its established cryptoperiod, when a key is compromised, or an entity is no longer part of the organization should be defined, implemented and evaluated processes, procedures and technical measures, which include provisions for legal and regulatory requirements.",CTRL-0000001601,"Where cryptography is used to protect stored account data, key management processes and procedures covering all aspects of the key lifecycle shall be defined and implemented."
FUNC-0000001018,"Risk assessment results should be reassessed annually for Very High and High risk, once every 2 years for Medium risk and once every 3 years for Low risk. Risk assessment results should be reassessed whenever there are significant changes that may impact the security state.",CTRL-0000001439,"Cyber security risk assessment results shall be formally documented, reported, and reassessed at appropriate intervals."
FUNC-0000001017,Risk assessment results should be reported to the designated Risk Owner (and relevant stakeholders).,CTRL-0000001439,"Cyber security risk assessment results shall be formally documented, reported, and reassessed at appropriate intervals."
FUNC-0000001019,Risks rated as “Very High” or “High” should be reassessed upon completion of the Risk Treatment Plan activities to assess the effectiveness of the treatment actions.,CTRL-0000001322,"Risk Treatment Options (mitigate, accept, transfer, avoid) should be identified and approved."
FUNC-0000001093,Role-based access control lists (e.g. group profiles) should be used whenever possible to control access rights. These access control lists should be in line with actual job/role responsibilities.,CTRL-0000001021,"Role-based access shall be granted to only perform authorised duties, which are relevant to corresponding job roles and responsibilities."
FUNC-0000001282,Root-cause-analysis should be undertaken periodically against common negative application security test results to detect common causes and address them through training and guidance.,CTRL-0000001033,Cyber security testing shall be undertaken before new or changed IT systems/applications are migrated to Production environments.
FUNC-0000001656,Rotate ZigBee Network Keys at least annually and disable the previous key upon distribution/establishment of the new network key.,CTRL-0000001421,"Wireless connectivity in the Company IT networks shall be securely designed and implemented, in order to ensure proper authentication, segregation, and data security."
FUNC-0000001103,"Routing capability should not be enabled on devices, other than those which are specifically designed for routing. IP routing should be implemented via a router or firewall. Where IP routing is required in the OT environment, static routing should be configured.",CTRL-0000001425,"A network segmentation architecture shall be established, documented and implemented for the Company IT/OT networks."
FUNC-0000001386,Routing emails directly sent to the destination systems or local relay systems should not be allowed.,CTRL-0000001358,"The Company email services shall be designed & implemented securely, in order to protect against SPAM and preserve message authenticity."
FUNC-0000001654,Scan geographic areas for jammers attempting to suppress Radio Frequency (RF) communications and execute incident response plans upon detection of such an event.,CTRL-0000001422,The Company IT network boundaries & perimeters shall be securely managed in order to effectively protect trusted networks from untrusted networks.
FUNC-0000001489,Schedule a task to update the asset/inventory database at least quarterly.,CTRL-0000001494,"Inventories of all Physical Assets shall be maintained, and periodically reviewed for accuracy & completeness."
FUNC-0000001235,Screen lockout should be enabled within 900 seconds of inactivity.,CTRL-0000001390,"The Company information accessed from, and stored in Mobile Devices shall be protected through a combination of device registration & authentication, access control, device-hardening in line with the Company End-point platform cyber security technical baselines, user awareness, and physical security controls."
FUNC-0000001671,Secondary authentication with Network Slice Specific Authentication and Authorization Function (NSSAAF) should be implemented by 5G network service provider for 5G network slicing to check if the subscribing organisation is authorized to use that slice.,CTRL-0000001415,"All users & devices shall be subject to the Company mandatory registration and authentication requirements, for access to all Company System Assets, using architectural components approved by the appointed CS architectural authorities."
FUNC-0000001203,"Secret and confidential paper documents should be disposed using a shredder, pulper or any other secure disposal mechanism.",CTRL-0000001399,"Documents shall be labelled (including physical copies) with the data classification for confidentiality by the person who created the document, to ensure that documents are identified and protected according to the classification level."
FUNC-0000001472,Secure coding practices based on international standards should be followed during the development phase.,CTRL-0000001389,"Guidance on principles, practices & techniques for secure System Assets development shall be provided, based on industry best practices for common models & platforms."
FUNC-0000001134,"Secured and encrypted communication channels should be used when migrating physical servers, applications, or data to virtualised servers and, where possible, should use a network segregated from Production networks for such migrations.",CTRL-0000001171,"Supplier agreements shall be established and documented with suppliers of all IT/OT solutions and/or services for the Company business use, via the Company standard procurement practices. These agreements shall include the relevant Company’s cyber security and legal & regulatory requirements."
FUNC-0000001581,"Securely configure all supporting network, software and infrastructure (e.g., web servers, cloud services, firewall, etc.) supporting the IoT system. Refer to specific secure configuration guidance for your system implementation.",CTRL-0000001186,"IT network device security shall be ensured through implementation of hardening specifications approved by the appointed CS architectural authorities, in combination with secure technical configuration & documented management processes, including firewall configuration and rule-set management."
FUNC-0000001664,Securely configure the Remote SIM Provisioning Platform that distributes eSIM profiles into UE eUICC's (secure elements).,CTRL-0000001421,"Wireless connectivity in the Company IT networks shall be securely designed and implemented, in order to ensure proper authentication, segregation, and data security."
FUNC-0000001210,"Security features are defined and implemented for all services, protocols, and ports that are in use and considered to be insecure, such that the risk is mitigated.",CTRL-0000001185,"Hardening specifications for all types of the Company-managed End-points shall be defined and approved by the appointed CS architectural authorities, to ensure that they can be Secure-by-Design."
FUNC-0000001461,"Security logs (e.g. failed attempts, denied access, input validation failures, or any failures in security policy checks) for API should be protected for integrity and integrated into Security Information and Event Management (SIEM) systems for monitoring and alerting.",CTRL-0000001513,"APIs shall be configured for secure access, secure API shielding, secure data transfer, and security event logging & monitoring."
FUNC-0000001249,"Security logs should be enabled on all database & middleware platforms (where applicable), and logs should be backed up or migrated to a central log collection server for monitoring purposes.",CTRL-0000001032,Databases & middleware platforms shall be hardened in accordance with the defined specifications and should be incorporated into the Vulnerability Management processes & tooling.
FUNC-0000001218,"Security logs should be enabled on all systems and devices, and logs should be backed up or migrated to a central log collection server for monitoring purposes.",CTRL-0000001031,End-points shall be hardened in accordance with the defined specifications.
FUNC-0000001382,"Security mechanisms, service levels and management requirements of all network services should be identified and included in network services agreements, whether these services are provided in-house or outsourced.",CTRL-0000001422,The Company IT network boundaries & perimeters shall be securely managed in order to effectively protect trusted networks from untrusted networks.
FUNC-0000001092,"Segregation of duties should be enforced when requesting, authorising and implementing access (e.g. requestor cannot also authorise the request).",CTRL-0000001021,"Role-based access shall be granted to only perform authorised duties, which are relevant to corresponding job roles and responsibilities."
FUNC-0000001302,"Segregation of duties should be in place, e.g. the change implementer and change approver should be different personnel.",CTRL-0000001038,"Changes to IT System Assets shall be formally requested, planned, approved and initiated. Changes to OT assets shall be as per the site's MOC procedures and guidelines and the PTW system of the facility."
FUNC-0000001196,"Sensitive Personal Data should be identified within the system (so that access can be highly restricted, and data carefully deleted if no longer required).",CTRL-0000001001,Personal Data and Sensitive Personal Data shall be processed in compliance with applicable data privacy laws.
FUNC-0000001195,"Sensitive Personal Data should be processed once the explicit consent from Data Subject has been obtained. Further, sensitive personal data should be processed only with valid justification and approval from Data Privacy Officer/Senior Management, and record/log of all processing activities should be maintained.",CTRL-0000001001,Personal Data and Sensitive Personal Data shall be processed in compliance with applicable data privacy laws.
FUNC-0000001930,"Sensitive technical information and data regarding System Assets (e.g. configuration information, API keys) should be treated as Confidential and duly protected.",CTRL-0000001422,"The Company information/data shall be secured in line with its classification, with access provided to users on a Least Privilege basis."
FUNC-0000001257,Service providers and/or developers should adhere to the project-specific CSRS throughout the project lifecycle.,CTRL-0000001387,"Cyber security shall be addressed as part of project delivery frameworks/models, to ensure that engagement with the Cyber Security Function occurs at appropriate times in projects, and that necessary controls are identified and implemented. The framework/model shall include the development & acquisition of hardware, software, on-premise & cloud-based services."
FUNC-0000001612,Set up monitoring procedures to identify and alert on abnormally heavy traffic transmitted from IoT devices.,CTRL-0000001052,IT System Assets rated as having SEVERE or MAJOR business impact in terms of Availability shall have appropriate High Availability features built into the architectural design to avoid single points of failure.
FUNC-0000001028,Shared Security Responsibility Model (SSRM) Guidance should be provided to the Common Service Center (CSC) detailing information about the SSRM applicability throughout the supply chain.,CTRL-0000001174,"There shall be integration between outsource/Cloud Service Providers (CSP's) and the Company's cyber security incident management process, in order to ensure effective management of cyber security incidents related to System Assets rated as having SEVERE business impact in terms of Confidentiality, Integrity, and/or Availability."
FUNC-0000001027,"Shared Security Responsibility Model (SSRM) should be applied, documented, implemented and managed throughout the supply chain for the cloud service offering.",CTRL-0000001174,"There shall be integration between outsource/Cloud Service Providers (CSP's) and the Company's cyber security incident management process, in order to ensure effective management of cyber security incidents related to System Assets rated as having SEVERE business impact in terms of Confidentiality, Integrity, and/or Availability."
FUNC-0000001029,"SOC2 Type II attestations should be obtained from CSPs providing services rated as SEVERE business impact.  This depends on testing all control criteria and discloses test results of service organization's control over specific review period. 
SOC3 attestations should be obtained for services rated as having MAJOR & MODERATE business impact.  The scope of this attestation is similar to SOC2, however details of test results are not provided, as the report is intended to be publicly available.",CTRL-0000001169,"SOC (System & Organization Controls) attestations shall be obtained from Cloud and/or outsourced providers for System Assets rated as having SEVERE business impact in terms of Confidentiality, Integrity, and/or Availability.  In cases where SOC attestation are not available, the Company should reserve the right in the contract to conduct audit on the supplier’s site, processes, personnel and controls."
FUNC-0000001276,Source code should not be stored on Production environments.,CTRL-0000001034,Source code shall be protected against unauthorised access or change.
FUNC-0000001380,Spam protection should be implemented at entry and exit points.,CTRL-0000001358,"The Company email services shall be designed & implemented securely, in order to protect against SPAM and preserve message authenticity."
FUNC-0000001054,"Strong password policies and procedures should be established, documented, approved, communicated, implemented, applied, evaluated and maintained. The policies and procedures should be reviewed and updated at least annually.",CTRL-0000001015,"A formal user account provisioning process shall be in place, for provision of all types of accounts."
FUNC-0000001014,"Subscription to independent reports and notifications from threat intelligence, regional and international CERTs and committees, known public vulnerability databases and forums which should be established and maintained.",CTRL-0000001457,"Information about security vulnerabilities of network & system hardware and software shall be obtained regularly from verified sources, including patch information."
FUNC-0000001013,Subscription to supplier-based reports and notifications from all IT and OT system and solution suppliers should be established and maintained to receive security vulnerability and patch information.,CTRL-0000001457,"Information about security vulnerabilities of network & system hardware and software shall be obtained regularly from verified sources, including patch information."
FUNC-0000001659,Supplement Z-Wave networks with AES 128 cryptographic keys for authentication.,CTRL-0000001421,"Wireless connectivity in the Company IT networks shall be securely designed and implemented, in order to ensure proper authentication, segregation, and data security."
FUNC-0000001440,Supplier agreements should address the protection of the confidentiality of Company’ information.,CTRL-0000001171,"Supplier agreements shall be established and documented with suppliers of all IT/OT solutions and/or services for the Company business use, via the Company standard procurement practices. These agreements shall include the relevant Company’s cyber security and legal & regulatory requirements."
FUNC-0000001441,Supplier agreements should address the secure transfer of information between Company and suppliers.,CTRL-0000001171,"Supplier agreements shall be established and documented with suppliers of all IT/OT solutions and/or services for the Company business use, via the Company standard procurement practices. These agreements shall include the relevant Company’s cyber security and legal & regulatory requirements."
FUNC-0000001436,"Supplier agreements should include terms for existing, terminating, renewing and renegotiating agreements.",CTRL-0000001171,"Supplier agreements shall be established and documented with suppliers of all IT/OT solutions and/or services for the Company business use, via the Company standard procurement practices. These agreements shall include the relevant Company’s cyber security and legal & regulatory requirements."
FUNC-0000001437,"Supplier agreements should incorporate identified Company cyber security requirements, including:
a. Security-relevant legal and regulatory requirements
b. Cyber security requirements for mitigating the risks associated with supplier’s access to Company’ assets
c. Obligations of each contractual party to implement security requirements and describe how they will be fulfilled
d. Cyber security risks associated with the supply chain of information and communication technology services and products
e. Procedures to ensure secure transfer of information between Company and suppliers
f. Monitoring and auditing of supplier services.",CTRL-0000001171,"Supplier agreements shall be established and documented with suppliers of all IT/OT solutions and/or services for the Company business use, via the Company standard procurement practices. These agreements shall include the relevant Company’s cyber security and legal & regulatory requirements."
FUNC-0000001363,"Suppliers of Physical Assets should be required to maintain an adequate stock of spares, to cater for minor damage.",CTRL-0000001362,"IT and OT Physical Assets shall be effectively maintained, commensurate with risk-assessment and defined controls."
FUNC-0000001365,"Suppliers of Physical Assets should be required to replace them within stated service levels, in the event of major damage.",CTRL-0000001362,"IT and OT Physical Assets shall be effectively maintained, commensurate with risk-assessment and defined controls."
FUNC-0000001026,"Suppliers should be required to designate a named individual or team having accountability for cyber security incidents, to act as the primary contact for the Company.",CTRL-0000001174,"There shall be integration between outsource/Cloud Service Providers (CSP's) and the Company's cyber security incident management process, in order to ensure effective management of cyber security incidents related to System Assets rated as having SEVERE business impact in terms of Confidentiality, Integrity, and/or Availability."
FUNC-0000001438,"Suppliers should be required to have fit-for-purpose cyber security policies & standards in place, deployed monitored, reviewed and approved.",CTRL-0000001171,"Supplier agreements shall be established and documented with suppliers of all IT/OT solutions and/or services for the Company business use, via the Company standard procurement practices. These agreements shall include the relevant Company’s cyber security and legal & regulatory requirements."
FUNC-0000001439,"Suppliers should be required to perform background checks for personnel, who are directly supporting Company, prior to commencement of the services.",CTRL-0000001171,"Supplier agreements shall be established and documented with suppliers of all IT/OT solutions and/or services for the Company business use, via the Company standard procurement practices. These agreements shall include the relevant Company’s cyber security and legal & regulatory requirements."
FUNC-0000001442,"Suppliers should be required to provide all personnel working under the contract with cyber security awareness education, and training on their cyber security policies and standards, on an annual basis.",CTRL-0000001171,"Supplier agreements shall be established and documented with suppliers of all IT/OT solutions and/or services for the Company business use, via the Company standard procurement practices. These agreements shall include the relevant Company’s cyber security and legal & regulatory requirements."
FUNC-0000001025,"Suppliers should be required to report to the Company immediately upon detection, any cyber security incidents impacting the Company System Assets.",CTRL-0000001174,"There shall be integration between outsource/Cloud Service Providers (CSP's) and the Company's cyber security incident management process, in order to ensure effective management of cyber security incidents related to System Assets rated as having SEVERE business impact in terms of Confidentiality, Integrity, and/or Availability."
FUNC-0000001444,"Suppliers who are/will be accessing Company’ information and systems should be bound by Non-Disclosure Agreements to keep Company information confidential, and to only use System Assets for the business purposes stated in the contract.",CTRL-0000001171,"Supplier agreements shall be established and documented with suppliers of all IT/OT solutions and/or services for the Company business use, via the Company standard procurement practices. These agreements shall include the relevant Company’s cyber security and legal & regulatory requirements."
FUNC-0000001450,Supply chain agreements between Cloud Service Providers (CSPs) and Common Service Centers (CSCs) should be reviewed at least annually.,CTRL-0000001171,"Supplier agreements shall be established and documented with suppliers of all IT/OT solutions and/or services for the Company business use, via the Company standard procurement practices. These agreements shall include the relevant Company’s cyber security and legal & regulatory requirements."
FUNC-0000001271,System and application communication with other systems/applications should be identified and communications security requirements should be defined and incorporated in the design phase.,CTRL-0000001386,"Guidance on principles, practices & techniques for secure System Assets design, shall be provided, based on industry best practices for common models & platforms."
FUNC-0000001259,"System Assets decommissioning should be planned and communicated to users, application owners and Head of Entity.",CTRL-0000001506,"System Assets decommissioning should be planned appropriately, to ensure proper management of data and user access per Records Management Standards & Guidelines, and data recoverability requirements."
FUNC-0000001270,System Assets should be designed with logging and auditing capabilities which meet the cyber security logging & monitoring requirements laid out in this Controls Standard.,CTRL-0000001386,"Guidance on principles, practices & techniques for secure System Assets design, shall be provided, based on industry best practices for common models & platforms."
FUNC-0000001105,System components that store cardholder data are not directly accessible from untrusted networks.,CTRL-0000001425,"A network segmentation architecture shall be established, documented and implemented for the Company IT/OT networks."
FUNC-0000001377,System event log collection processes should be periodically checked to ensure they are continuing to collect event data as expected.,CTRL-0000001050,System event logging shall be enabled on IT and OT System Assets.
FUNC-0000001373,System event logs should be backed up in accordance with the frequency defined in the backup process.,CTRL-0000001050,System event logging shall be enabled on IT and OT System Assets.
FUNC-0000001374,"System event logs should be protected from unauthorised access, modification and deletion.",CTRL-0000001050,System event logging shall be enabled on IT and OT System Assets.
FUNC-0000001371,System event logs should be stored and retained as per the retention requirements.,CTRL-0000001050,System event logging shall be enabled on IT and OT System Assets.
FUNC-0000001369,System event logs should be timestamped and synchronised (e.g.to a synchronised NTP time server).,CTRL-0000001050,System event logging shall be enabled on IT and OT System Assets.
