Guidance_ID,Guidance_Description,Control_ID,Control_Description
FUNC-0000001669,5G network slicing should be implemented by 5G network service provider to enable the creation of multiple logical networks over the same physical infrastructure for the purposes of network isolation.,CTRL-0000001425,"A network segmentation architecture shall be established, documented and implemented for the Company IT/OT networks."
FUNC-0000001330,A backup of legacy systems should be tested whenever there is a change in environment and with regular agreed frequency (e.g. Quarterly) to ensure that legacy data backups are still readable by new backup devices.,CTRL-0000001382,"Backup restoration shall be tested as per schedule, where defined in the backup & restore plan."
FUNC-0000001289,"A change record should contain details which include but are not limited to: requestor details, change type, change description expected outage window, rollback plan, business and service impact, cyber security risk assessment, dependencies etc.",CTRL-0000001038,"Changes to IT System Assets shall be formally requested, planned, approved and initiated. Changes to OT assets shall be as per the site's MOC procedures and guidelines and the PTW system of the facility."
FUNC-0000001253,"A cyber security advisor should be assigned to all projects involving new System Assets deployment, or enhancements.",CTRL-0000001387,"Cyber security shall be addressed as part of project delivery frameworks/models, to ensure that engagement with the Cyber Security Function occurs at appropriate times in projects, and that necessary controls are identified and implemented. The framework/model shall include the development & acquisition of hardware, software, on-premise & cloud-based services."
FUNC-0000001346,"A data wipe should be initiated for lost or stolen Mobile Devices containing Company data, when necessary and feasible, with BYOD users made aware up-front of the potential for wiping of (some areas of, or all of) their device storage.",CTRL-0000001517,"Data shall be securely disposed of, in accordance with any defined retention policy & disposal procedures, where applicable."
FUNC-0000001262,"A formal communication should be sent to users, System Assets owners and Head of Entity about the permanent shutdown of the System Assets.",CTRL-0000001506,"System Assets decommissioning should be planned appropriately, to ensure proper management of data and user access per Records Management Standards & Guidelines, and data recoverability requirements."
FUNC-0000001049,"A formal user registration and de-registration procedure should be in place for granting and revoking access to all information systems and services, covering all types of accounts.",CTRL-0000001015,"A formal user account provisioning process shall be in place, for provision of all types of accounts."
FUNC-0000001408,"A full system scan should be performed on new IT assets at deployment time, and monthly thereafter. For OT, scans will be performed as per OEM guidelines.",CTRL-0000001055,"Detection, prevention and recovery controls to protect against malware shall be implemented, combined with appropriate standards, guidelines and procedures in place, including user awareness and training."
FUNC-0000001123,A guest network with internet access should be restricted from accessing internal networks.,CTRL-0000001421,"Wireless connectivity in the Company IT networks shall be securely designed and implemented, in order to ensure proper authentication, segregation, and data security."
FUNC-0000001416,"A licenced anti-virus suite (firewall, anti-virus, and web site protector applications) should be installed on BYOC/BYOD devices.",CTRL-0000001351,Agreements for use of BYOC/BYOD devices in the Company networks shall include the requirement for up-to-date anti-malware protection.
FUNC-0000001367,"A monitoring and internal reporting capability should be established and maintained over the operations of cryptographic, encryption and key management policies, processes, procedures, and controls.",CTRL-0000001051,Cyber security requirements for event logging shall be identified for IT and OT System Assets.
FUNC-0000001916,A network device at a zone boundary should provide the capability to monitor and control communications at zone boundaries to enforce the compartmentalization defined in the riskbased zones and conduits model.,CTRL-0000001099,SR 5.2 - The control system shall provide the capability to monitor and control communications at zone boundaries to enforce the compartmentalization defined in the risk-based zones and conduits model.
FUNC-0000001920,"A network device at a zone boundary should provide the capability to protect against general purpose, person-to-person messages from being received from users or systems external to the control system.",CTRL-0000001151,SR 5.3 - The control system shall provide the capability to prevent general purpose person-to-person messages from being received from users or systems external to the control system.
FUNC-0000001868,"A network device supporting wireless access management should provide the capability to identify and authenticate all users (humans, software processes or devices) engaged in
wireless communication.",CTRL-0000001080,"SR 1.6 - The control system shall provide the capability to identify and authenticate all users (humans, software processes or devices) engaged in wireless communication."
FUNC-0000001291,"A Normal request should be raised if the change causes major impact, but is not bound to a critical timeframe as emergency change.",CTRL-0000001038,"Changes to IT System Assets shall be formally requested, planned, approved and initiated. Changes to OT assets shall be as per the site's MOC procedures and guidelines and the PTW system of the facility."
FUNC-0000001070,"A notification email should be sent to the user and account sponsor, at least 3 days prior to disabling access.",CTRL-0000001019,Inactive accounts shall be disabled to avoid the risks of unused/unnecessary accounts being present for unauthorised use.
FUNC-0000001147,"A notification of a password expiry date, with a recommendation to change the password, should be sent to the user at least 3 days prior to expiry.",CTRL-0000001181,"All accounts used to access System Assets shall be securely configured, with strong passwords implemented as defined by the appointed CS architectural authorities for each technology domain."
FUNC-0000001228,A Personal Firewall solution (e.g. Windows Defender) should be installed on Company-managed laptops.  This is also strongly recommended for BYOC.,CTRL-0000001390,"The Company information accessed from, and stored in Mobile Devices shall be protected through a combination of device registration & authentication, access control, device-hardening in line with the Company End-point platform cyber security technical baselines, user awareness, and physical security controls."
FUNC-0000001143,A random password generator should be used to generate initial passwords or reset passwords.,CTRL-0000001181,"All accounts used to access System Assets shall be securely configured, with strong passwords implemented as defined by the appointed CS architectural authorities for each technology domain."
FUNC-0000001065,"A record of privileged IT access requests should be formally maintained, along with details of the corresponding approvals and entitlements in the appointed CS architectural authorities-approved tool.",CTRL-0000001013,"Use of privileged IT/OT accounts shall be strictly controlled, to avoid the risks of system misuse or compromize."
FUNC-0000001045,A record of who uses an emergency account should be retained for a minimum of 18 months.,CTRL-0000001011,"Emergency accounts shall only be used when access to privileged accounts is unavailable, and shall be strictly controlled."
FUNC-0000001185,A record/audit trail should be maintained for movements of all non-end-user assets (e.g. servers & network devices).,CTRL-0000001403,The Company-owned Physical Assets shall not be taken off-site without prior authorisation.
FUNC-0000001241,"A request should be raised, and management approval obtained prior to connection a BYOC device to the Company network.",CTRL-0000001516,Mobile Application Assets rated as having SEVERE or MAJOR business impact in terms of Confidentiality shall have appropriate Mobile Application Management (MAM) features enforced and enabled.
FUNC-0000001297,"A roll-back plan should be produced, including steps and responsibilities for aborting and recovering from unsuccessful changes, or if there are unforeseen events.",CTRL-0000001038,"Changes to IT System Assets shall be formally requested, planned, approved and initiated. Changes to OT assets shall be as per the site's MOC procedures and guidelines and the PTW system of the facility."
FUNC-0000001254,A security assurance plan to address cyber security requirements defined in CSRS should be provided by the Service provider.,CTRL-0000001387,"Cyber security shall be addressed as part of project delivery frameworks/models, to ensure that engagement with the Cyber Security Function occurs at appropriate times in projects, and that necessary controls are identified and implemented. The framework/model shall include the development & acquisition of hardware, software, on-premise & cloud-based services."
FUNC-0000001199,"A service should be available to Data Subjects to request a copy of their Personal Data /Sensitive Personal Data. Further a system should be available for the Data User to securely provide a copy of their PD/SPD requested within a reasonable timeframe of receipt of request, and to enable them the Data Subject to have the data records corrected or deleted, according to their wishes.",CTRL-0000001000,Personal Data and Sensitive Personal Data shall be managed & controlled in compliance with applicable data privacy laws.
FUNC-0000001451,A site-to-site encrypted solution should be implemented for scenarios where remote access is required for a group of users (e.g. for Company satellite office).,CTRL-0000001176,"Remote access to the Company internal IT/OT networks shall be controlled to avoid the risk of external compromise, with access provided via standard, securely-managed encrypted services approved by the appointed CS architectural authorities."
FUNC-0000001293,"A Standard change request should be raised for changes with low-to-no impact on production, or for which approval is already granted (also referred to as a pre-authorised change).",CTRL-0000001038,"Changes to IT System Assets shall be formally requested, planned, approved and initiated. Changes to OT assets shall be as per the site's MOC procedures and guidelines and the PTW system of the facility."
FUNC-0000001529,"A unified framework business continuity plan should be created, documented, and adopted to ensure all business continuity plans are consistent in addressing priorities for backup, recovery, testing, maintenance, and information security requirements.",CTRL-0000001475,The Company’s business continuity strategy and plans should reflect requirements for DR Plans for System Assets rated as having SEVERE or MAJOR business impact with respect to Availability.
FUNC-0000001033,A user ID should not be utilised by anyone except the individual to whom the ID has been issued. Individuals are responsible for all activities performed with their assigned user ID.,CTRL-0000001006,"Unique user ID's shall be attested, securely created and assigned to individual Employees, Contractors, and Third Party Users."
FUNC-0000001090,Access should be granted according to the principle of “Least Privilege”. Access should not be extended unless a legitimate business-requirement for specific access is formally requested and approved.,CTRL-0000001021,"Role-based access shall be granted to only perform authorised duties, which are relevant to corresponding job roles and responsibilities."
FUNC-0000001050,Access should be only granted on the services or systems that an individual has been specifically authorised to use as per business requirements.,CTRL-0000001015,"A formal user account provisioning process shall be in place, for provision of all types of accounts."
FUNC-0000001072,"Access should be revoked or appropriately modified under any of the following circumstances:
i. any change of role or position within Company organization;
ii. departure from Company organization at the end of employment or contract;
iii. security breaches;
iv. disciplinary breaches; and
v. inappropriate, negligent, or malicious behaviour.",CTRL-0000001018,There shall be a user access review process in place to ensure accounts are still required and access rights remain appropriate.
FUNC-0000001080,Access to a Visitor should be granted for the defined duration as per requirement.,CTRL-0000001429,Visitor access to the Company’s premises shall be strictly managed.
FUNC-0000001457,Access to API servers should be limited based on the capacity of servers and network bandwidth.,CTRL-0000001513,"APIs shall be configured for secure access, secure API shielding, secure data transfer, and security event logging & monitoring."
FUNC-0000001240,"Access to company information, application or information systems from an untrusted network via BYOC/BYOD should be allowed only through the VPN/portal or reverse proxy.",CTRL-0000001516,Mobile Application Assets rated as having SEVERE or MAJOR business impact in terms of Confidentiality shall have appropriate Mobile Application Management (MAM) features enforced and enabled.
FUNC-0000001138,"Access to Company System Assets should be authenticated through Single Sign-On (SSO), or through alternative methods approved by the appointed CS architectural authorities.",CTRL-0000001415,"All users & devices shall be subject to the Company mandatory registration and authentication requirements, for access to all Company System Assets, using architectural components approved by the appointed CS architectural authorities."
FUNC-0000001087,Access to patch panels and cable rooms should restricted.,CTRL-0000001426,"Delivery and loading areas shall have restricted access, and shall be segregated from other areas of the premises."
FUNC-0000001278,Access to source code should be restricted to designated development personnel.,CTRL-0000001034,Source code shall be protected against unauthorised access or change.
FUNC-0000001211,"Access to the End-point system BIOS should be restricted to authorised personnel only, using password protection.",CTRL-0000001031,End-points shall be hardened in accordance with the defined specifications.
FUNC-0000001084,Access to these areas should be restricted to identified and authorised individuals.,CTRL-0000001426,"Delivery and loading areas shall have restricted access, and shall be segregated from other areas of the premises."
FUNC-0000001145,Account lockout counter should be set to a minimum of fifteen (15) minutes.,CTRL-0000001181,"All accounts used to access System Assets shall be securely configured, with strong passwords implemented as defined by the appointed CS architectural authorities for each technology domain."
FUNC-0000001144,Accounts should be locked after a maximum of 10 attempts within 15 mins for Company domain login as defined by the appointed CS architecture authorities. A warning message will be displayed to advise the use of this limit after the first failed attempt.,CTRL-0000001181,"All accounts used to access System Assets shall be securely configured, with strong passwords implemented as defined by the appointed CS architectural authorities for each technology domain."
FUNC-0000001588,Acquire IoT devices that integrate Microcontroller Units (MCUs) with hardware-based separation architectures to meet high assurance requirements. Configure security-sensitive applications to run within the trusted zone of the hardware. Configure device attestation of software prior to entering into the trusted mode.,CTRL-0000001171,"Supplier agreements shall be established and documented with suppliers of all IT/OT solutions and/or services for the Company business use, via the Company standard procurement practices. These agreements shall include the relevant Company’s cyber security and legal & regulatory requirements."
FUNC-0000001573,Acquire IoT products that have undergone testing and received a device security certification.,CTRL-0000001169,"SOC (System & Organization Controls) attestations shall be obtained from Cloud and/or outsourced providers for System Assets rated as having SEVERE business impact in terms of Confidentiality, Integrity, and/or Availability.  In cases where SOC attestation are not available, the Company should reserve the right in the contract to conduct audit on the supplier’s site, processes, personnel and controls."
FUNC-0000001602,Actively search for indicators of compromise such as new botnet activity. Immediately remove infected IoT devices upon detection.,CTRL-0000001452,"Automated mechanisms (e.g. End-point Tools, Network Monitoring and Forensics Tools, Incident Workflow Management Tools) shall be employed to effectively execute threat hunting, prompt security alerts and provide advisory information."
FUNC-0000001452,Activities of vendors with remote access should be continuously monitored in real time throughout the remote session.,CTRL-0000001176,"Remote access to the Company internal IT/OT networks shall be controlled to avoid the risk of external compromise, with access provided via standard, securely-managed VPN services approved by the appointed CS architectural authorities."
FUNC-0000001190,"Adequate consent should be received from the Data Subject prior to data collection, and the consent obtained should be recorded & retained.",CTRL-0000001003,Personal Data and Sensitive Personal Data shall be collected in compliance with applicable data privacy laws.
FUNC-0000001388,"Adequate protection against denial of service/distributed denial of service (DoS/DDoS) attack should be ensured by Cloud Service Provider (CSP) for System Assets rated as having SEVERE business impact in terms of Availability, that are to be hosted in the Cloud.",CTRL-0000001052,IT System Assets rated as having SEVERE or MAJOR business impact in terms of Availability shall have appropriate High Availability features built into the architectural design to avoid single points of failure.
FUNC-0000001459,Administrative functions should not be exposed as APIs.,CTRL-0000001513,"APIs shall be configured for secure access, secure API shielding, secure data transfer, and security event logging & monitoring."
FUNC-0000001627,"Adopt a software assurance maturity model (SAMM) to establish a secure development lifecycle for all developed IoT devices and components  (e.g., OWASP SAMM).",CTRL-0000001190,"A Secure System Development Life Cycle methodology shall be developed, deployed and maintained (e.g. DevSecOps), and shall be kept up-to-date to reflect and cater for new and emerging application platforms. All developments at the Company shall follow the chosen methodology."
FUNC-0000001620,"Adopt and define a standardized industry recognized risk management methodology that considers context, Risk Assessment (Risk Identification, Analysis, Evaluation), Treatment and Monitoring & Feedback. Effective risk management supports Information technology and baseline requirements as well as the organization's overall business strategy, goals and objectives.",CTRL-0000001451,"The Cyber Risk Management Guidelines & Procedures shall describe the scope, approach/method responding to cyber risk, and prioritizing risk treatment."
FUNC-0000001520,"After cataloguing data within an IoT system, identify any locations and systems which store that data and apply Data-at-Rest encryption controls to those locations and systems. Monitor to ensure that new systems and components are not implemented without evaluating their storage of sensitive information.",CTRL-0000001182,"The Company information/data classified as Secret, or handled by System Assets rated as having SEVERE business impact with respect to Confidentiality and/or Integrity, shall be protected by Strong Encryption or hosted in a Secure Cell, whilst at rest on IT or OT systems."
FUNC-0000001052,"All accounts (including service, default, administrative accounts), should have a nominated owner/sponsor.",CTRL-0000001015,"A formal user account provisioning process shall be in place, for provision of all types of accounts."
FUNC-0000001041,All activities performed with emergency accounts should be logged.,CTRL-0000001011,"Emergency accounts shall only be used when access to privileged accounts is unavailable, and shall be strictly controlled."
FUNC-0000001323,All backed up data should be stored in a secure location.,CTRL-0000001045,"Data backups shall be logged, and securely stored/maintained in accordance with the agreed backup and restoration plan."
FUNC-0000001467,All certificates used for network devices should be current.,CTRL-0000001186,"IT network device security shall be ensured through implementation of hardening specifications approved by the appointed CS architectural authorities, in combination with secure technical configuration & documented management processes, including firewall configuration and rule-set management."
FUNC-0000001304,All change activity should be logged and monitored.,CTRL-0000001037,Changes shall be deployed in accordance with the agreed roll-out plan for the change.
FUNC-0000001306,All changes performed should be reviewed and signed-off by the System Assets Owner.,CTRL-0000001042,"Changes to IT & OT System Assets shall be reviewed to ensure that they were successful, and then finally signed off by the relevant authority."
FUNC-0000001305,"All changes to information systems should be tested in a separate test environment (wherever possible) before implementation in a Production environment. Testing should include looking for security impacts due to flaws, weaknesses, incompatibility, or intentional malice.",CTRL-0000001036,"Changes to IT System Assets shall be properly tested in Test environments (where available), prior to deployment in Production. Changes to OT Assets, as per the MOC, shall be tested in the Factory Acceptance Test (FAT) followed by Site Acceptance Test (SAT). Testing shall cover cyber security aspects, where appropriate (e.g. negative testing of access controls)."
FUNC-0000001152,"All Company Employees and Contractors should be trained before onboarding, and then periodically reminded about/updated on Cyber Security trends, practices, and responsibilities.",CTRL-0000001410,A Cyber Security Awareness & Training Programme shall be designed and applied for all Company Employees and Contractors.
FUNC-0000001214,"All Company-managed End-point assets should be members of Company domain, and standalone systems should be discouraged.",CTRL-0000001031,End-points shall be hardened in accordance with the defined specifications.
FUNC-0000001233,"All Company-managed Mobile Devices, should have encrypted local storage, to protect Company information/data.",CTRL-0000001390,"The Company information accessed from, and stored in Mobile Devices shall be protected through a combination of device registration & authentication, access control, device-hardening in line with the Company End-point platform cyber security technical baselines, user awareness, and physical security controls."
FUNC-0000001110,All connections to the internet and other networks should be through suitably configured firewalls and access control lists on the routers.,CTRL-0000001422,The Company IT network boundaries & perimeters shall be securely managed in order to effectively protect trusted networks from untrusted networks.
FUNC-0000001426,All cyber reported security incidents should be logged in an IT Service Management (ITSM) tool.,CTRL-0000001345,"Cyber security events (that are anomalous to a normal expected baseline of operations & data flows) shall be flagged and reported as a potential cyber security incident as promptly as possible, upon detection."
FUNC-0000001244,"All database & middleware platforms should have hardening specifications selected or developed for them (e.g. relevant CIS Benchmarks, or Company platform security specifications), based on industry best practices.",CTRL-0000001188,"Hardening specifications for database technologies & common middleware platforms shall be defined, approved by the appointed CS architectural authorities, and implemented, to ensure that they can be properly secured."
FUNC-0000001424,All detected successful and failed cyber security breaches should be reported as a cyber security incident.,CTRL-0000001345,"Cyber security events (that are anomalous to a normal expected baseline of operations & data flows) shall be flagged and reported as a potential cyber security incident as promptly as possible, upon detection."
FUNC-0000001150,"All Employees and, Contractors who have access to Company Production networks and information assets should receive appropriate awareness and training on Company cyber security requirements and expectations.",CTRL-0000001410,A Cyber Security Awareness & Training Programme shall be designed and applied for all Company Employees and Contractors.
FUNC-0000001213,"All End-point assets should use a Company-approved Operating System build, as a basis for installation.",CTRL-0000001031,End-points shall be hardened in accordance with the defined specifications.
