Guidance_ID,Guidance_Description,Control_ID,Control_Description
FUNC-0000001859,Components should provide the capability to maintain essential functions when operating in a degraded mode as the result of a DoS event.,CTRL-0000001112,SR 7.1 - The control system shall provide the capability to operate in a degraded mode during a DoS event.
FUNC-0000001860,Components should provide the capability to mitigate the effects of information and/or message flooding types of DoS events.,CTRL-0000001114,SR 7.1 RE 1 - The control system shall provide the capability to manage communication loads (such as using rate limiting) to mitigate the effects of information flooding types of DoS events.
FUNC-0000001861,Components should provide the capability to participate in system level backup operations in order to safeguard the component state (user- and system-level information). The backup process should not affect the normal component operations.,CTRL-0000001124,KEY CONTROL - SR 7.3 - The identity and location of critical files and the ability to conduct backups of user-level and system-level information (including system state information) shall be supported by the control system without affecting normal plant operations.
FUNC-0000001842,"Components should provide the capability to perform or support authenticity checks on software, configuration and other information as well as the recording and reporting of the results of these checks or be integrated into a system that can perform or support authenticity checks.",CTRL-0000001116,"SR 3.4 - The control system shall provide the capability to detect, record, report and protect against unauthorized changes to software and information at rest."
FUNC-0000001841,"Components should provide the capability to perform or support integrity checks on software, configuration and other information as well as the recording and reporting of the results of these checks or be integrated into a system that can perform or support integrity checks.",CTRL-0000001116,"SR 3.4 - The control system shall provide the capability to detect, record, report and protect against unauthorized changes to software and information at rest."
FUNC-0000001852,"Components should provide the capability to protect against unauthorized and unintended information transfer via volatile shared memory resources.
Volatile memory resources are those that generally do not retain information after being released to memory management. However, there are attacks against random access memory (RAM) which might extract key material or other confidential data before it is actually over-written. Therefore, when volatile shared memory is released back to the control system for use by a different user, all unique data and connections to unique data need to be purged from the resource so it is not visible or accessible to the new user.",CTRL-0000001130,SR 4.2 RE 1 - The control system shall provide the capability to prevent unauthorized and unintended information transfer via volatile shared memory resources.
FUNC-0000001814,"Components should provide the capability to protect critical, long-lived private keys via hardware mechanisms.",CTRL-0000001104,SR 1.9 RE 1 - The control system shall provide the capability to protect the relevant private keys via hardware mechanisms according to commonly accepted security industry practices and recommendations.
FUNC-0000001839,Components should provide the capability to protect integrity of transmitted information.,CTRL-0000001102,SR 3.1 - The control system shall provide the capability to protect the integrity of transmitted information.
FUNC-0000001867,"Components should provide the capability to specifically restrict the use of unnecessary functions, ports, protocols and/or services.",CTRL-0000001120,"SR 7.7 - The control system shall provide the capability to specifically prohibit and/or restrict the use of unnecessary functions, ports, protocols and/or services."
FUNC-0000001850,Components should provide the capability to store audit records on hardware-enforced write-once media.,CTRL-0000001156,SR 3.9 RE 1 - The control system shall provide the capability to produce audit records on hardware-enforced write-once media.
FUNC-0000001870,Components should provide the capability to support a control system component inventory according to IEC 62443-3-3 SR 7.8.,CTRL-0000001070,KEY CONTROL - SR 7.8 - The control system shall provide the capability to report the current list of installed components and their associated properties.
FUNC-0000001805,Components should provide the capability to support the management of all accounts directly or integrated into a system that manages accounts according to IEC 62443‑3‑3 SR 1.3.,CTRL-0000001072,"SR 1.3 - The control system shall provide the capability to support the management of all accounts by authorized users, including adding, activating, modifying, disabling and removing accounts."
FUNC-0000001838,Components should provide the capability to support verification of the intended operation of security functions according to IEC 62443-3-3 SR3.3.,CTRL-0000001117,"SR 3.3 RE 2 - The control system shall provide the capability to support verification of the intended operation of security functions and report when anomalies are discovered during FAT, SAT and scheduled maintenance. These security functions shall include all those necessary to support the security requirements specified in this standard."
FUNC-0000001840,"Components should provide the capability to support verification of the intended operation of security functions during normal operations.
This RE needs to be carefully implemented to avoid detrimental effects. It may not be suitable for safety systems.",CTRL-0000001119,SR 3.3 - The control system shall provide the capability to support verification of the intended operation of security functions during normal operations.
FUNC-0000001800,Components should provide the capability to uniquely identify and authenticate all human users.,CTRL-0000001069,SR 1.1 RE 1 - The control system shall provide the capability to uniquely identify and authenticate all human users.
FUNC-0000001804,Components should provide the capability to uniquely identify and authenticate itself to any other component.,CTRL-0000001074,SR 1.2 RE 1 - The control system shall provide the capability to uniquely identify and authenticate all software processes and devices.
FUNC-0000001863,Components should provide the capability to validate the integrity of backed up information prior to the initiation of a restore of that information.,CTRL-0000001126,SR 7.3 RE 1 - The control system shall provide the capability to verify the reliability of backup mechanisms.
FUNC-0000001853,Components should provide the capability to verify that the erasure of information occurred.,CTRL-0000001129,SR 4.2 - The control system shall provide the capability to purge all information for which explicit read authorization is supported from components to be released from active service and/or decommissioned.
FUNC-0000001837,"Components should provide the capability to verify the authenticity of received information during communication.
NOTE: Both integrity protection and authentication of origin can be achieved without providing confidentiality
protection.",CTRL-0000001105,SR 3.1 RE 1 - The control system shall provide the capability to employ cryptographic mechanisms to recognize changes to information during communication.
FUNC-0000001807,"Components should provide the capability to:
a) support the use of initial authenticator content;
b) support the recognition of changes to default authenticators made at installation time;
c) function properly with periodic authenticator change/refresh operation; and
d) protect authenticators from unauthorized disclosure and modification when stored, used and transmitted.",CTRL-0000001077,"SR 1.5 - The control system shall provide the capability to:
a) initialize authenticator content;
b) change all default authenticators upon control system installation;
c) change/refresh all authenticators; and
d) protect all authenticators from unauthorized disclosure and modification when stored and transmitted."
FUNC-0000001811,"Components should provide, or integrate into a system that provides, the capability to enforce password minimum and maximum lifetime restrictions for all users.",CTRL-0000001086,SR 1.7 RE 2 - The control system shall provide the capability to enforce password minimum and maximum lifetime restrictions for all users.
FUNC-0000001810,"Components should provide, or integrate into a system that provides, the capability to protect against any given human user account from reusing a password for a configurable
number of generations. In addition, the component should provide the capability to enforce password minimum and maximum lifetime restrictions for human users. These capabilities should conform to commonly accepted security industry practices. The component should provide the capability to prompt the user to change their password upon a configurable time prior to expiration.",CTRL-0000001083,"SR 1.7 RE 1 - The control system shall provide the capability to prevent any given human user account from reusing a password for a configurable number of generations. In addition, the control system shall provide the capability to enforce password minimum and maximum lifetime restrictions for human users. These capabilities shall conform with commonly accepted security industry practices."
FUNC-0000001854,"Components should support a segmented network to support zones and conduits, as needed, to support the broader network architecture based on logical segmentation and criticality.",CTRL-0000001095,KEY CONTROL - SR 5.1 - The control system shall provide the capability to logically segment control system networks from non-control system networks and to logically segment critical control system networks from other control system networks.
FUNC-0000001820,"Components should support a supervisor manual override for a configurable time or sequence of events.
NOTE: Implementation of a controlled, audited and manual override of automated mechanisms in the event of emergencies or other serious events allows a supervisor to enable an operator to quickly react to unusual conditions without closing the current session and establishing a new session as a higher privilege human user.",CTRL-0000001093,SR 2.1 RE 3 - The control system shall support supervisor manual override of the current human user authorizations for a configurable time or event sequence.
FUNC-0000001823,"Components should support dual approval when action can result in serious impact on the industrial process.
Dual approval should be limited to actions which require a very high level of confidence that they will be performed reliably and correctly. Requiring dual approval provides
emphasis to the seriousness of consequences that would result from failure of a correct action. An example of a situation in which dual approval is required would be a change to a set point of a critical industrial process. Dual approval mechanisms should not be employed when an immediate response is necessary to safeguard HSE consequences, for example, emergency shutdown of an industrial process.",CTRL-0000001094,SR 2.1 RE 4 - The control system shall support dual approval where an action can result in serious impact on the industrial process.
FUNC-0000001844,"Components should validate the syntax, length and content of any input data that is used as an industrial process control input or input via external interfaces that directly impacts the action of the component.",CTRL-0000001146,SR 3.5 - The control system shall validate the syntax and content of any input which is used as an industrial process control input or input that directly impacts the action of the control system.
FUNC-0000001821,"Components should, directly or through a compensating security mechanism, provide for an authorized role to define and modify the mapping of permissions to roles for all human users.
Roles should not be limited to fixed nested hierarchies in which a higher-level role is a super set of a lesser privileged role. For example, a system administrator should not necessarily encompass operator privileges.
NOTE: This RE is applicable to software processes and devices as well.",CTRL-0000001092,SR 2.1 RE 2 - The control system shall provide the capability for an authorized user or role to define and modify the mapping of permissions to roles for all human users.
FUNC-0000001846,Components that physically or logically connect to an automation process should provide the capability to set outputs to a predetermined state if normal operation as defined by the component supplier cannot be maintained.,CTRL-0000001152,SR 3.6 - The control system shall provide the capability to set outputs to a predetermined state if normal operation cannot be maintained as a result of an attack.
FUNC-0000001536,Conduct fault tree analysis to identify and prioritize safety risks associated with the IoT system.,CTRL-0000001482,"System assets shall be categorised based on the impact ratings in the CS BIA, for impact of loss of Confidentiality, integrity and/or availability.  
There are five impact levels: Severe, Major, Moderate, Minor, Insignificant."
FUNC-0000001632,"Conduct threat modeling at the onset of any device or system development effort.  Use a standardized approach to threat modeling that includes the identification of components, data flows,and high value code. Define the threats, prioritize (e.g., rate) the threats and identify mitigations.  Communicate the outputs of your threat model into the system requirements backlog and track these requirements to closure across the lifecycle of the product or system.",CTRL-0000001455,"Threat hunting activities for identifying emerging threats shall be defined. The Company’s Threat Hunting Procedure shall cover hypothesis, research, investigation, detection and analysis, informing, reporting and enrichment."
FUNC-0000001204,"Confidential data should be sanitised before being used in Development/Test environment, otherwise, similar levels of security controls should be applied to the Development/Test environment as to Production.",CTRL-0000001005,"Protective controls shall be applied to handle data in Development & Test environments, according to its classification."
FUNC-0000001644,Configure a software-defined perimeter (SDP) that authenticates IoT devices  prior to connection to the network and restricts activities based on their pre-approved role and privileges.,CTRL-0000001425,"A network segmentation architecture shall be established, documented and implemented for the Company IT/OT networks."
FUNC-0000001493,Configure allowlists on cloud gateways to accept communications from only trusted devices.  Log attempted communications from unauthorized devices.,CTRL-0000001171,"Supplier agreements shall be established and documented with suppliers of all IT/OT solutions and/or services for the Company business use, via the Company standard procurement practices. These agreements shall include the relevant Company’s cyber security and legal & regulatory requirements."
FUNC-0000001539,"Configure certificate-based authentication on IoT devices, gateways, and services.",CTRL-0000001601,"Where cryptography is used to protect stored account data, key management processes and procedures covering all aspects of the key lifecycle shall be defined and implemented."
FUNC-0000001491,Configure cloud services securely.,CTRL-0000001171,"Supplier agreements shall be established and documented with suppliers of all IT/OT solutions and/or services for the Company business use, via the Company standard procurement practices. These agreements shall include the relevant Company’s cyber security and legal & regulatory requirements."
FUNC-0000001651,Configure IoT devices to drop new incoming communication attempts. Require that IoT devices initiate all communications.,CTRL-0000001017,Remote connection shall be disabled by default on End-Points.
FUNC-0000001542,"Configure IoT devices, gateways, services, and applications to communicate only with authorized peers and service endpoints.",CTRL-0000001023,"Access policies shall be defined for Company networks, System Assets and services."
FUNC-0000001665,Configure WPA2 or WPA3 encryption mode on Wi-Fi networks.,CTRL-0000001421,"Wireless connectivity in the Company IT networks shall be securely designed and implemented, in order to ensure proper authentication, segregation, and data security."
FUNC-0000001130,"Connections between end-users and a Public Cloud Network-hosted System Assets should be encrypted unless, the information being passed is classified as Open.",CTRL-0000001171,"Supplier agreements shall be established and documented with suppliers of all IT/OT solutions and/or services for the Company business use, via the Company standard procurement practices. These agreements shall include the relevant Company’s cyber security and legal & regulatory requirements."
FUNC-0000001131,Connections from Public Cloud to the Company Network should be controlled via a Cloud Integration Platform.,CTRL-0000001171,"Supplier agreements shall be established and documented with suppliers of all IT/OT solutions and/or services for the Company business use, via the Company standard procurement practices. These agreements shall include the relevant Company’s cyber security and legal & regulatory requirements."
FUNC-0000001590,Consider all contracts necessary. Include indemnification clauses where applicable. Consider areas of security and privacy and responsibility for the same. Obtain consent where necessary. Consider jurisdictional requirements and enforceability of contracts including contracts with organizations in jurisdictions where likelihood of enforcement is unlikely or very difficult. Consider enforceability of clauses in particular jurisdictions. A law in one jurisdiction may not be applicable in another; consider this carefully.,CTRL-0000001171,"Supplier agreements shall be established and documented with suppliers of all IT/OT solutions and/or services for the Company business use, via the Company standard procurement practices. These agreements shall include the relevant Company’s cyber security and legal & regulatory requirements."
FUNC-0000001591,Consider all major liability areas associated with IoT system. Consider possible legal exposure within IoT system that might be as a result of something the organization can control. Consider areas outside of organizations control and whether that is addressed in liability disclaimed. Create and implement a plan to address each major area of potential liability after understanding the risks.,CTRL-0000001171,"Supplier agreements shall be established and documented with suppliers of all IT/OT solutions and/or services for the Company business use, via the Company standard procurement practices. These agreements shall include the relevant Company’s cyber security and legal & regulatory requirements."
FUNC-0000001677,Consider any applicable rules or restrictions on data transfer and comply with same.,CTRL-0000001465,"All the Company applicable cyber security statutory, regulatory, contractual, and compliance requirements shall be identified, incorporated in cyber security guidelines, frameworks & procedures, and adhered to."
FUNC-0000001599,"Consider industry, product and service supply chain risks, threats and vulnerabilities that may have legal implications.",CTRL-0000001445,A supply chain risk management process shall be defined covering the cyber security risk aspects of the use of Suppliers for outsourced & subscription-based IT services.
FUNC-0000001409,Continuous Anti-virus scanning should be performed for all End-point assets (wherever technically possible for OT End-points),CTRL-0000001055,"Detection, prevention and recovery controls to protect against malware shall be implemented, combined with appropriate standards, guidelines and procedures in place, including user awareness and training."
FUNC-0000001522,Create a governance framework for the IoT system. Define who is accountable and responsible for the security of distributed systems and their interconnection to cloud and other data services. Require the identification of executive leadership accountable for each individual system and define the responsibilities of those responsible for securing those systems. Identify and document the roles and responsibilities of employees and third-party users for protection of data and assets within IoT systems.,CTRL-0000001470,"The Company’s governing Cyber Security policies, frameworks, standards, guidelines, procedures and checklists shall be defined, reviewed periodically, and communicated to all relevant stakeholders."
FUNC-0000001534,"Create a set of terms and conditions as well as a privacy policy associated with IoT system and specific devices as required by law or recommended. Consider data collected, whether it will be personal data/confidential data or identifiable to an individual, use of data, whether it can be or will be sold to any parties, whether instances of new data being collected may arise. Ensure compliance with all jurisdictions. Create a separate privacy policy or a supplemental privacy policy as needed for specific jurisdictions. Have this reviewed by legal counsel. Do not overpromise privacy or engage in deceptive or unfair practices, these may be used against the organization. Obtain informed consent to terms and conditions as well as privacy policy. Ensure these are agreed to as a contract in relevant jurisdictions.",CTRL-0000001000,Personal Data and Sensitive Personal Data shall be managed & controlled in compliance with applicable data privacy laws.
FUNC-0000001597,Create an implementation plan to comply with legal requirements for IoT System. Include specific technical and organizational implementation of interpreted legal rules based on IoT system.  Build in measures to comply with legal rights of consumers and/or users of IoT system. Consider reasonable security and privacy measures where required by law.  Build in mechanisms to securely collect personal or confidential data.  Build in mechanisms to provide data and correct errors in data where required by law.  Consider data minimization and principle of least privilege.  Consider how to block data from getting into hands of unauthorized individuals or organizations.  Assess whether any appointments of personnel are required under law.  Conduct due diligence when approving third parties related to IoT system.,CTRL-0000001465,"All the Company applicable cyber security statutory, regulatory, contractual, and compliance requirements shall be identified, incorporated in cyber security guidelines, frameworks & procedures, and adhered to."
FUNC-0000001589,"Create disclosures, disclaimers and waivers related to the IoT system necessary to protect the organization. Consider third party liability. Consider all required consumer or other notifications. Review breach notification rules and be prepared with how to comply in the event of a breach.",CTRL-0000001171,"Supplier agreements shall be established and documented with suppliers of all IT/OT solutions and/or services for the Company business use, via the Company standard procurement practices. These agreements shall include the relevant Company’s cyber security and legal & regulatory requirements."
FUNC-0000001172,"Create keys in a pre-activated state when they have been generated but not authorized for use should be defined, implemented and evaluated processes, procedures and technical measures, which include provisions for legal and regulatory requirements.",CTRL-0000001601,"Where cryptography is used to protect stored account data, key management processes and procedures covering all aspects of the key lifecycle shall be defined and implemented."
FUNC-0000001609,Create maintenance plans to routinely inspect and upkeep IoT hardware. Keep parts on hand in inventory in case an IoT device requires repair or replacement. Take immediate action when a maintenance issue is identified by repairing or replacing the IoT device.,CTRL-0000001362,"IT and OT Physical Assets shall be effectively maintained, commensurate with risk-assessment and defined controls."
FUNC-0000001043,Creation of test accounts should be allowed in the Test environment only and approved by the appropriate authoriser.,CTRL-0000001008,"Test accounts shall be strictly controlled, in order to avoid risks of compromise, or impact on Production systems."
FUNC-0000001357,Cyber Security Findings & Risk Treatment Plans should be periodically monitored to track timely progress & closure.,CTRL-0000001048,"Processes & procedures shall be defined to ensure that action plans are developed to address findings/non-compliances in a timely way.  Unaddressed findings shall be registered, then duly risk-assessed and treated, as per the Cyber Security Risk Management Guidelines & Procedures."
FUNC-0000001024,"Cyber Security Incident Response Plans from outsource/CSP's, that relate to System Assets rated as having SEVERE business impact in terms of Availability, should involve relevant stakeholders & service providers, from Company and other businesses in the supply chain.",CTRL-0000001174,"There shall be integration between outsource/Cloud Service Providers (CSP's) and the Company's cyber security incident management process, in order to ensure effective management of cyber security incidents related to System Assets rated as having SEVERE business impact in terms of Confidentiality, Integrity, and/or Availability."
